============================================================
Training Started: 2025-11-22 18:02:11
============================================================
Architecture: Transformer-based Classifier (TensorFlow)
Using device: CPU

Loading dataset...
 cry: 2093 files
 not_cry: 2093 files

Calculating normalization statistics from training data...
Train: 2930, Val: 628, Test: 628
Normalization stats - Mean: -45.6554, Std: 16.8370

Loading dataset...
 cry: 2093 files
 not_cry: 2093 files

Calculating normalization statistics from training data...
Train: 2930, Val: 628, Test: 628
Normalization stats - Mean: -45.6554, Std: 16.8370

Class distribution:
 Class 0 (cry): 1465 samples (50.0%)
 Class 1 (not_cry): 1465 samples (50.0%)
Class weights: {0: 1.0, 1: 1.0}

Saved normalization stats - Mean: -45.6554, Std: 16.8370

Model parameters: 15,066
✓ Within parameter budget (1,934 remaining)

============================================================
Starting Training Loop
============================================================

============================================================
Epoch 1/100
============================================================

Train - Loss: 0.5112 | Acc: 0.7720 | F1: 0.7719
Train Confusion Matrix:
[[1105  360]
 [ 308 1157]]

Val  - Loss: 0.3304 | Acc: 0.8631 | F1: 0.8630 | AUC: 0.9321
Val Confusion Matrix:
[[267  47]
 [ 39 275]]
LR: 0.000300
✓ Saved best model with F1: 0.8630, Acc: 0.8631

============================================================
Epoch 2/100
============================================================

Train - Loss: 0.3274 | Acc: 0.8696 | F1: 0.8696
Train Confusion Matrix:
[[1253  212]
 [ 170 1295]]

Val  - Loss: 0.2909 | Acc: 0.8822 | F1: 0.8819 | AUC: 0.9511
Val Confusion Matrix:
[[293  21]
 [ 53 261]]
LR: 0.000300
✓ Saved best model with F1: 0.8819, Acc: 0.8822

============================================================
Epoch 3/100
============================================================

Train - Loss: 0.2775 | Acc: 0.8823 | F1: 0.8823
Train Confusion Matrix:
[[1286  179]
 [ 166 1299]]

Val  - Loss: 0.2397 | Acc: 0.9045 | F1: 0.9044 | AUC: 0.9654
Val Confusion Matrix:
[[289  25]
 [ 35 279]]
LR: 0.000300
✓ Saved best model with F1: 0.9044, Acc: 0.9045

============================================================
Epoch 4/100
============================================================

Train - Loss: 0.2340 | Acc: 0.9096 | F1: 0.9096
Train Confusion Matrix:
[[1338  127]
 [ 138 1327]]

Val  - Loss: 0.2048 | Acc: 0.9299 | F1: 0.9299 | AUC: 0.9726
Val Confusion Matrix:
[[294  20]
 [ 24 290]]
LR: 0.000300
✓ Saved best model with F1: 0.9299, Acc: 0.9299

============================================================
Epoch 5/100
============================================================

Train - Loss: 0.2094 | Acc: 0.9222 | F1: 0.9222
Train Confusion Matrix:
[[1350  115]
 [ 113 1352]]

Val  - Loss: 0.2040 | Acc: 0.9363 | F1: 0.9363 | AUC: 0.9774
Val Confusion Matrix:
[[299  15]
 [ 25 289]]
LR: 0.000300
✓ Saved best model with F1: 0.9363, Acc: 0.9363

============================================================
Epoch 6/100
============================================================

Train - Loss: 0.1920 | Acc: 0.9345 | F1: 0.9345
Train Confusion Matrix:
[[1374   91]
 [ 101 1364]]

Val  - Loss: 0.1856 | Acc: 0.9268 | F1: 0.9267 | AUC: 0.9792
Val Confusion Matrix:
[[287  27]
 [ 19 295]]
LR: 0.000300
Patience: 1/20

============================================================
Epoch 7/100
============================================================

Train - Loss: 0.1904 | Acc: 0.9369 | F1: 0.9369
Train Confusion Matrix:
[[1373   92]
 [  93 1372]]

Val  - Loss: 0.1834 | Acc: 0.9379 | F1: 0.9379 | AUC: 0.9804
Val Confusion Matrix:
[[299  15]
 [ 24 290]]
LR: 0.000300
✓ Saved best model with F1: 0.9379, Acc: 0.9379

============================================================
Epoch 8/100
============================================================

Train - Loss: 0.1836 | Acc: 0.9375 | F1: 0.9375
Train Confusion Matrix:
[[1379   86]
 [  97 1368]]

Val  - Loss: 0.1757 | Acc: 0.9459 | F1: 0.9458 | AUC: 0.9816
Val Confusion Matrix:
[[303  11]
 [ 23 291]]
LR: 0.000300
✓ Saved best model with F1: 0.9458, Acc: 0.9459

============================================================
Epoch 9/100
============================================================

Train - Loss: 0.1735 | Acc: 0.9386 | F1: 0.9386
Train Confusion Matrix:
[[1381   84]
 [  96 1369]]

Val  - Loss: 0.1815 | Acc: 0.9363 | F1: 0.9363 | AUC: 0.9825
Val Confusion Matrix:
[[294  20]
 [ 20 294]]
LR: 0.000300
Patience: 1/20

============================================================
Epoch 10/100
============================================================

Train - Loss: 0.1656 | Acc: 0.9437 | F1: 0.9437
Train Confusion Matrix:
[[1386   79]
 [  86 1379]]

Val  - Loss: 0.1599 | Acc: 0.9475 | F1: 0.9474 | AUC: 0.9850
Val Confusion Matrix:
[[301  13]
 [ 20 294]]
LR: 0.000300
✓ Saved best model with F1: 0.9474, Acc: 0.9475

============================================================
Epoch 11/100
============================================================

Train - Loss: 0.1578 | Acc: 0.9485 | F1: 0.9485
Train Confusion Matrix:
[[1397   68]
 [  83 1382]]

Val  - Loss: 0.1591 | Acc: 0.9379 | F1: 0.9379 | AUC: 0.9852
Val Confusion Matrix:
[[291  23]
 [ 16 298]]
LR: 0.000300
Patience: 1/20

============================================================
Epoch 12/100
============================================================

Train - Loss: 0.1558 | Acc: 0.9478 | F1: 0.9478
Train Confusion Matrix:
[[1396   69]
 [  84 1381]]

Val  - Loss: 0.1502 | Acc: 0.9506 | F1: 0.9506 | AUC: 0.9861
Val Confusion Matrix:
[[301  13]
 [ 18 296]]
LR: 0.000300
✓ Saved best model with F1: 0.9506, Acc: 0.9506

============================================================
Epoch 13/100
============================================================

Train - Loss: 0.1484 | Acc: 0.9471 | F1: 0.9471
Train Confusion Matrix:
[[1385   80]
 [  75 1390]]

Val  - Loss: 0.1611 | Acc: 0.9443 | F1: 0.9443 | AUC: 0.9856
Val Confusion Matrix:
[[298  16]
 [ 19 295]]
LR: 0.000300
Patience: 1/20

============================================================
Epoch 14/100
============================================================

Train - Loss: 0.1445 | Acc: 0.9509 | F1: 0.9509
Train Confusion Matrix:
[[1391   74]
 [  70 1395]]

Val  - Loss: 0.1546 | Acc: 0.9538 | F1: 0.9538 | AUC: 0.9871
Val Confusion Matrix:
[[306   8]
 [ 21 293]]
LR: 0.000300
✓ Saved best model with F1: 0.9538, Acc: 0.9538

============================================================
Epoch 15/100
============================================================

Train - Loss: 0.1392 | Acc: 0.9526 | F1: 0.9526
Train Confusion Matrix:
[[1408   57]
 [  82 1383]]

Val  - Loss: 0.1708 | Acc: 0.9443 | F1: 0.9443 | AUC: 0.9869
Val Confusion Matrix:
[[298  16]
 [ 19 295]]
LR: 0.000300
Patience: 1/20

============================================================
Epoch 16/100
============================================================

Train - Loss: 0.1414 | Acc: 0.9512 | F1: 0.9512
Train Confusion Matrix:
[[1397   68]
 [  75 1390]]

Val  - Loss: 0.1684 | Acc: 0.9522 | F1: 0.9522 | AUC: 0.9852
Val Confusion Matrix:
[[306   8]
 [ 22 292]]
LR: 0.000300
Patience: 2/20

============================================================
Epoch 17/100
============================================================

Train - Loss: 0.1359 | Acc: 0.9529 | F1: 0.9529
Train Confusion Matrix:
[[1403   62]
 [  76 1389]]

Val  - Loss: 0.1419 | Acc: 0.9506 | F1: 0.9506 | AUC: 0.9874
Val Confusion Matrix:
[[300  14]
 [ 17 297]]
LR: 0.000300
Patience: 3/20

============================================================
Epoch 18/100
============================================================

Train - Loss: 0.1350 | Acc: 0.9549 | F1: 0.9549
Train Confusion Matrix:
[[1405   60]
 [  72 1393]]

Val  - Loss: 0.1643 | Acc: 0.9443 | F1: 0.9443 | AUC: 0.9859
Val Confusion Matrix:
[[298  16]
 [ 19 295]]
LR: 0.000300
Patience: 4/20

============================================================
Epoch 19/100
============================================================

Train - Loss: 0.1290 | Acc: 0.9563 | F1: 0.9563
Train Confusion Matrix:
[[1408   57]
 [  71 1394]]

Val  - Loss: 0.1522 | Acc: 0.9554 | F1: 0.9554 | AUC: 0.9838
Val Confusion Matrix:
[[303  11]
 [ 17 297]]
LR: 0.000300
✓ Saved best model with F1: 0.9554, Acc: 0.9554

============================================================
Epoch 20/100
============================================================

Train - Loss: 0.1284 | Acc: 0.9573 | F1: 0.9573
Train Confusion Matrix:
[[1413   52]
 [  73 1392]]

Val  - Loss: 0.1658 | Acc: 0.9427 | F1: 0.9427 | AUC: 0.9855
Val Confusion Matrix:
[[292  22]
 [ 14 300]]
LR: 0.000300
Patience: 1/20

============================================================
Epoch 21/100
============================================================

Train - Loss: 0.1225 | Acc: 0.9580 | F1: 0.9580
Train Confusion Matrix:
[[1411   54]
 [  69 1396]]

Val  - Loss: 0.1516 | Acc: 0.9506 | F1: 0.9506 | AUC: 0.9863
Val Confusion Matrix:
[[300  14]
 [ 17 297]]
LR: 0.000300
Patience: 2/20

============================================================
Epoch 22/100
============================================================

Train - Loss: 0.1223 | Acc: 0.9580 | F1: 0.9580
Train Confusion Matrix:
[[1415   50]
 [  73 1392]]

Val  - Loss: 0.1541 | Acc: 0.9522 | F1: 0.9522 | AUC: 0.9841
Val Confusion Matrix:
[[303  11]
 [ 19 295]]
LR: 0.000300
Patience: 3/20

============================================================
Epoch 23/100
============================================================

Train - Loss: 0.1188 | Acc: 0.9594 | F1: 0.9594
Train Confusion Matrix:
[[1415   50]
 [  69 1396]]

Val  - Loss: 0.1576 | Acc: 0.9538 | F1: 0.9538 | AUC: 0.9840
Val Confusion Matrix:
[[302  12]
 [ 17 297]]
LR: 0.000300
Patience: 4/20

============================================================
Epoch 24/100
============================================================

Train - Loss: 0.1163 | Acc: 0.9645 | F1: 0.9645
Train Confusion Matrix:
[[1423   42]
 [  62 1403]]

Val  - Loss: 0.1394 | Acc: 0.9570 | F1: 0.9570 | AUC: 0.9866
Val Confusion Matrix:
[[305   9]
 [ 18 296]]
LR: 0.000300
✓ Saved best model with F1: 0.9570, Acc: 0.9570

============================================================
Epoch 25/100
============================================================

Train - Loss: 0.1154 | Acc: 0.9631 | F1: 0.9631
Train Confusion Matrix:
[[1418   47]
 [  61 1404]]

Val  - Loss: 0.1463 | Acc: 0.9554 | F1: 0.9554 | AUC: 0.9874
Val Confusion Matrix:
[[302  12]
 [ 16 298]]
LR: 0.000300
Patience: 1/20

============================================================
Epoch 26/100
============================================================

Train - Loss: 0.1132 | Acc: 0.9655 | F1: 0.9655
Train Confusion Matrix:
[[1424   41]
 [  60 1405]]

Val  - Loss: 0.1380 | Acc: 0.9586 | F1: 0.9586 | AUC: 0.9867
Val Confusion Matrix:
[[305   9]
 [ 17 297]]
LR: 0.000300
✓ Saved best model with F1: 0.9586, Acc: 0.9586

============================================================
Epoch 27/100
============================================================

Train - Loss: 0.1091 | Acc: 0.9642 | F1: 0.9642
Train Confusion Matrix:
[[1426   39]
 [  66 1399]]

Val  - Loss: 0.1382 | Acc: 0.9522 | F1: 0.9522 | AUC: 0.9875
Val Confusion Matrix:
[[300  14]
 [ 16 298]]
LR: 0.000300
Patience: 1/20

============================================================
Epoch 28/100
============================================================

Train - Loss: 0.1031 | Acc: 0.9645 | F1: 0.9645
Train Confusion Matrix:
[[1422   43]
 [  61 1404]]

Val  - Loss: 0.1410 | Acc: 0.9618 | F1: 0.9618 | AUC: 0.9869
Val Confusion Matrix:
[[306   8]
 [ 16 298]]
LR: 0.000300
✓ Saved best model with F1: 0.9618, Acc: 0.9618

============================================================
Epoch 29/100
============================================================

Train - Loss: 0.1016 | Acc: 0.9659 | F1: 0.9659
Train Confusion Matrix:
[[1431   34]
 [  66 1399]]

Val  - Loss: 0.1434 | Acc: 0.9538 | F1: 0.9538 | AUC: 0.9882
Val Confusion Matrix:
[[296  18]
 [ 11 303]]
LR: 0.000300
Patience: 1/20

============================================================
Epoch 30/100
============================================================

Train - Loss: 0.1059 | Acc: 0.9638 | F1: 0.9638
Train Confusion Matrix:
[[1419   46]
 [  60 1405]]

Val  - Loss: 0.1522 | Acc: 0.9618 | F1: 0.9618 | AUC: 0.9879
Val Confusion Matrix:
[[300  14]
 [ 10 304]]
LR: 0.000300
✓ Saved best model with F1: 0.9618, Acc: 0.9618

============================================================
Epoch 31/100
============================================================

Train - Loss: 0.0991 | Acc: 0.9686 | F1: 0.9686
Train Confusion Matrix:
[[1430   35]
 [  57 1408]]

Val  - Loss: 0.1484 | Acc: 0.9570 | F1: 0.9570 | AUC: 0.9872
Val Confusion Matrix:
[[301  13]
 [ 14 300]]
LR: 0.000300
Patience: 1/20

============================================================
Epoch 32/100
============================================================

Train - Loss: 0.1045 | Acc: 0.9655 | F1: 0.9655
Train Confusion Matrix:
[[1428   37]
 [  64 1401]]

Val  - Loss: 0.1508 | Acc: 0.9554 | F1: 0.9554 | AUC: 0.9888
Val Confusion Matrix:
[[297  17]
 [ 11 303]]
LR: 0.000300
Patience: 2/20

============================================================
Epoch 33/100
============================================================

Train - Loss: 0.0998 | Acc: 0.9676 | F1: 0.9676
Train Confusion Matrix:
[[1423   42]
 [  53 1412]]

Val  - Loss: 0.1380 | Acc: 0.9586 | F1: 0.9586 | AUC: 0.9880
Val Confusion Matrix:
[[302  12]
 [ 14 300]]
LR: 0.000300
Patience: 3/20

============================================================
Epoch 34/100
============================================================

Train - Loss: 0.1005 | Acc: 0.9672 | F1: 0.9672
Train Confusion Matrix:
[[1428   37]
 [  59 1406]]

Val  - Loss: 0.1680 | Acc: 0.9475 | F1: 0.9475 | AUC: 0.9879
Val Confusion Matrix:
[[297  17]
 [ 16 298]]
LR: 0.000300
Patience: 4/20

============================================================
Epoch 35/100
============================================================

Train - Loss: 0.0961 | Acc: 0.9662 | F1: 0.9662
Train Confusion Matrix:
[[1422   43]
 [  56 1409]]

Val  - Loss: 0.1330 | Acc: 0.9602 | F1: 0.9602 | AUC: 0.9886
Val Confusion Matrix:
[[307   7]
 [ 18 296]]
LR: 0.000300
Patience: 5/20

============================================================
Epoch 36/100
============================================================

Train - Loss: 0.0891 | Acc: 0.9693 | F1: 0.9693
Train Confusion Matrix:
[[1428   37]
 [  53 1412]]

Val  - Loss: 0.1573 | Acc: 0.9506 | F1: 0.9506 | AUC: 0.9875
Val Confusion Matrix:
[[300  14]
 [ 17 297]]
LR: 0.000300
Patience: 6/20
Reducing learning rate to 0.0001500000071246177

============================================================
Epoch 37/100
============================================================

Train - Loss: 0.0886 | Acc: 0.9700 | F1: 0.9700
Train Confusion Matrix:
[[1429   36]
 [  52 1413]]

Val  - Loss: 0.1563 | Acc: 0.9506 | F1: 0.9506 | AUC: 0.9878
Val Confusion Matrix:
[[300  14]
 [ 17 297]]
LR: 0.000150
Patience: 7/20

============================================================
Epoch 38/100
============================================================

Train - Loss: 0.0906 | Acc: 0.9683 | F1: 0.9683
Train Confusion Matrix:
[[1428   37]
 [  56 1409]]

Val  - Loss: 0.1634 | Acc: 0.9475 | F1: 0.9475 | AUC: 0.9877
Val Confusion Matrix:
[[297  17]
 [ 16 298]]
LR: 0.000150
Patience: 8/20

============================================================
Epoch 39/100
============================================================

Train - Loss: 0.0873 | Acc: 0.9693 | F1: 0.9693
Train Confusion Matrix:
[[1429   36]
 [  54 1411]]

Val  - Loss: 0.1565 | Acc: 0.9522 | F1: 0.9522 | AUC: 0.9881
Val Confusion Matrix:
[[299  15]
 [ 15 299]]
LR: 0.000150
Patience: 9/20

============================================================
Epoch 40/100
============================================================

Train - Loss: 0.0843 | Acc: 0.9734 | F1: 0.9734
Train Confusion Matrix:
[[1434   31]
 [  47 1418]]

Val  - Loss: 0.1540 | Acc: 0.9538 | F1: 0.9538 | AUC: 0.9884
Val Confusion Matrix:
[[301  13]
 [ 16 298]]
LR: 0.000150
Patience: 10/20

============================================================
Epoch 41/100
============================================================

Train - Loss: 0.0868 | Acc: 0.9703 | F1: 0.9703
Train Confusion Matrix:
[[1436   29]
 [  58 1407]]

Val  - Loss: 0.1546 | Acc: 0.9570 | F1: 0.9570 | AUC: 0.9886
Val Confusion Matrix:
[[300  14]
 [ 13 301]]
LR: 0.000150
Patience: 11/20

============================================================
Epoch 42/100
============================================================

Train - Loss: 0.0912 | Acc: 0.9683 | F1: 0.9683
Train Confusion Matrix:
[[1424   41]
 [  52 1413]]

Val  - Loss: 0.1372 | Acc: 0.9666 | F1: 0.9666 | AUC: 0.9883
Val Confusion Matrix:
[[305   9]
 [ 12 302]]
LR: 0.000150
✓ Saved best model with F1: 0.9666, Acc: 0.9666

============================================================
Epoch 43/100
============================================================

Train - Loss: 0.0905 | Acc: 0.9686 | F1: 0.9686
Train Confusion Matrix:
[[1425   40]
 [  52 1413]]

Val  - Loss: 0.1381 | Acc: 0.9570 | F1: 0.9570 | AUC: 0.9890
Val Confusion Matrix:
[[303  11]
 [ 16 298]]
LR: 0.000150
Patience: 1/20

============================================================
Epoch 44/100
============================================================

Train - Loss: 0.0859 | Acc: 0.9724 | F1: 0.9724
Train Confusion Matrix:
[[1432   33]
 [  48 1417]]

Val  - Loss: 0.1505 | Acc: 0.9554 | F1: 0.9554 | AUC: 0.9884
Val Confusion Matrix:
[[303  11]
 [ 17 297]]
LR: 0.000150
Patience: 2/20

============================================================
Epoch 45/100
============================================================

Train - Loss: 0.0855 | Acc: 0.9710 | F1: 0.9710
Train Confusion Matrix:
[[1432   33]
 [  52 1413]]

Val  - Loss: 0.1400 | Acc: 0.9570 | F1: 0.9570 | AUC: 0.9888
Val Confusion Matrix:
[[305   9]
 [ 18 296]]
LR: 0.000150
Patience: 3/20

============================================================
Epoch 46/100
============================================================

Train - Loss: 0.0891 | Acc: 0.9703 | F1: 0.9703
Train Confusion Matrix:
[[1431   34]
 [  53 1412]]

Val  - Loss: 0.1548 | Acc: 0.9522 | F1: 0.9522 | AUC: 0.9881
Val Confusion Matrix:
[[300  14]
 [ 16 298]]
LR: 0.000150
Patience: 4/20

============================================================
Epoch 47/100
============================================================

Train - Loss: 0.0904 | Acc: 0.9693 | F1: 0.9693
Train Confusion Matrix:
[[1428   37]
 [  53 1412]]

Val  - Loss: 0.1342 | Acc: 0.9634 | F1: 0.9634 | AUC: 0.9891
Val Confusion Matrix:
[[304  10]
 [ 13 301]]
LR: 0.000150
Patience: 5/20

============================================================
Epoch 48/100
============================================================

Train - Loss: 0.0822 | Acc: 0.9717 | F1: 0.9717
Train Confusion Matrix:
[[1431   34]
 [  49 1416]]

Val  - Loss: 0.1264 | Acc: 0.9650 | F1: 0.9650 | AUC: 0.9894
Val Confusion Matrix:
[[305   9]
 [ 13 301]]
LR: 0.000150
Patience: 6/20
Reducing learning rate to 7.500000356230885e-05

============================================================
Epoch 49/100
============================================================

Train - Loss: 0.0827 | Acc: 0.9724 | F1: 0.9724
Train Confusion Matrix:
[[1441   24]
 [  57 1408]]

Val  - Loss: 0.1337 | Acc: 0.9602 | F1: 0.9602 | AUC: 0.9894
Val Confusion Matrix:
[[305   9]
 [ 16 298]]
LR: 0.000075
Patience: 7/20

============================================================
Epoch 50/100
============================================================

Train - Loss: 0.0804 | Acc: 0.9713 | F1: 0.9713
Train Confusion Matrix:
[[1435   30]
 [  54 1411]]

Val  - Loss: 0.1376 | Acc: 0.9602 | F1: 0.9602 | AUC: 0.9893
Val Confusion Matrix:
[[303  11]
 [ 14 300]]
LR: 0.000075
Patience: 8/20

============================================================
Epoch 51/100
============================================================

Train - Loss: 0.0776 | Acc: 0.9727 | F1: 0.9727
Train Confusion Matrix:
[[1433   32]
 [  48 1417]]

Val  - Loss: 0.1473 | Acc: 0.9570 | F1: 0.9570 | AUC: 0.9887
Val Confusion Matrix:
[[302  12]
 [ 15 299]]
LR: 0.000075
Patience: 9/20

============================================================
Epoch 52/100
============================================================

Train - Loss: 0.0766 | Acc: 0.9737 | F1: 0.9737
Train Confusion Matrix:
[[1437   28]
 [  49 1416]]

Val  - Loss: 0.1389 | Acc: 0.9602 | F1: 0.9602 | AUC: 0.9892
Val Confusion Matrix:
[[303  11]
 [ 14 300]]
LR: 0.000075
Patience: 10/20

============================================================
Epoch 53/100
============================================================

Train - Loss: 0.0728 | Acc: 0.9747 | F1: 0.9747
Train Confusion Matrix:
[[1441   24]
 [  50 1415]]

Val  - Loss: 0.1498 | Acc: 0.9538 | F1: 0.9538 | AUC: 0.9890
Val Confusion Matrix:
[[301  13]
 [ 16 298]]
LR: 0.000075
Patience: 11/20

============================================================
Epoch 54/100
============================================================

Train - Loss: 0.0774 | Acc: 0.9734 | F1: 0.9734
Train Confusion Matrix:
[[1432   33]
 [  45 1420]]

Val  - Loss: 0.1499 | Acc: 0.9570 | F1: 0.9570 | AUC: 0.9892
Val Confusion Matrix:
[[300  14]
 [ 13 301]]
LR: 0.000075
Patience: 12/20

============================================================
Epoch 55/100
============================================================

Train - Loss: 0.0799 | Acc: 0.9751 | F1: 0.9751
Train Confusion Matrix:
[[1436   29]
 [  44 1421]]

Val  - Loss: 0.1393 | Acc: 0.9618 | F1: 0.9618 | AUC: 0.9896
Val Confusion Matrix:
[[303  11]
 [ 13 301]]
LR: 0.000075
Patience: 13/20

============================================================
Epoch 56/100
============================================================

Train - Loss: 0.0772 | Acc: 0.9758 | F1: 0.9758
Train Confusion Matrix:
[[1440   25]
 [  46 1419]]

Val  - Loss: 0.1468 | Acc: 0.9570 | F1: 0.9570 | AUC: 0.9894
Val Confusion Matrix:
[[303  11]
 [ 16 298]]
LR: 0.000075
Patience: 14/20

============================================================
Epoch 57/100
============================================================

Train - Loss: 0.0720 | Acc: 0.9751 | F1: 0.9751
Train Confusion Matrix:
[[1438   27]
 [  46 1419]]

Val  - Loss: 0.1515 | Acc: 0.9570 | F1: 0.9570 | AUC: 0.9892
Val Confusion Matrix:
[[303  11]
 [ 16 298]]
LR: 0.000075
Patience: 15/20

============================================================
Epoch 58/100
============================================================

Train - Loss: 0.0731 | Acc: 0.9744 | F1: 0.9744
Train Confusion Matrix:
[[1436   29]
 [  46 1419]]

Val  - Loss: 0.1442 | Acc: 0.9570 | F1: 0.9570 | AUC: 0.9892
Val Confusion Matrix:
[[303  11]
 [ 16 298]]
LR: 0.000075
Patience: 16/20

============================================================
Epoch 59/100
============================================================

Train - Loss: 0.0756 | Acc: 0.9727 | F1: 0.9727
Train Confusion Matrix:
[[1430   35]
 [  45 1420]]

Val  - Loss: 0.1499 | Acc: 0.9554 | F1: 0.9554 | AUC: 0.9893
Val Confusion Matrix:
[[302  12]
 [ 16 298]]
LR: 0.000075
Patience: 17/20

============================================================
Epoch 60/100
============================================================

Train - Loss: 0.0749 | Acc: 0.9754 | F1: 0.9754
Train Confusion Matrix:
[[1435   30]
 [  42 1423]]

Val  - Loss: 0.1490 | Acc: 0.9570 | F1: 0.9570 | AUC: 0.9891
Val Confusion Matrix:
[[303  11]
 [ 16 298]]
LR: 0.000075
Patience: 18/20

============================================================
Epoch 61/100
============================================================

Train - Loss: 0.0777 | Acc: 0.9741 | F1: 0.9741
Train Confusion Matrix:
[[1434   31]
 [  45 1420]]

Val  - Loss: 0.1348 | Acc: 0.9586 | F1: 0.9586 | AUC: 0.9897
Val Confusion Matrix:
[[304  10]
 [ 16 298]]
LR: 0.000075
Patience: 19/20

============================================================
Epoch 62/100
============================================================

Train - Loss: 0.0781 | Acc: 0.9744 | F1: 0.9744
Train Confusion Matrix:
[[1437   28]
 [  47 1418]]

Val  - Loss: 0.1477 | Acc: 0.9570 | F1: 0.9570 | AUC: 0.9892
Val Confusion Matrix:
[[304  10]
 [ 17 297]]
LR: 0.000075
Patience: 20/20

Early stopping triggered after 62 epochs

============================================================
Testing Best Model
============================================================

Final Test Results:
 Loss:   0.1357
 Accuracy: 0.9713 (97.13%)
 F1 Score: 0.9713
 AUC:    0.9870

Test Confusion Matrix:
[[308   6]
 [ 12 302]]

Per-Class Test Metrics:
 Cry class:
  Precision: 0.9625
  Recall:  0.9809
 Not Cry class:
  Precision: 0.9805
  Recall:  0.9618

============================================================
Training Completed: 2025-11-22 18:08:14
Best Val F1: 0.9666, Best Val Acc: 0.9666
Log saved to: /Users/theepireddykarthikreddy/Desktop/SILICON/SILICON-1/other_architectures/architecture4/logs/training_log_20251122_180211.txt
============================================================
